"ID","DESCRIZIONE","ORDINAMENTO","DATAINIZIOVALIDITA","DATAFINEVALIDITA"
"1","Indirizzo di posta elettronica dell'utente","0","20-07-2020","31-12-9999"
"2","Indirizzo di posta elettronica certificata dell'utente","0","20-07-2020","31-12-9999"
"3","Numero di telefono cellulare dell'utente","0","20-07-2020","31-12-9999"
"4","Numero di telefono fisso dell'utente","0","20-07-2020","31-12-9999"
"99","Tipologia di recapito non censita","0","20-07-2020","31-12-9999"
"5","Indirizzo di posta elettronica certificata eletto come Domicilio Digitale","0","20-07-2020","31-12-9999"
"6","Indirizzo di posta elettronica dell'utente indicato nella pratica di iscrizione","0","10-10-2022","31-12-9999"
