"ID","DESCRIZIONE","ORDINAMENTO","DATAINIZIOVALIDITA","DATAFINEVALIDITA"
"1","Di essere proprietario dell'abitazione contraddistinta dai seguenti estremi catastali:","0","13-10-2021","31-12-9999"
"2","Di essere intestatario del contratto di locazione regolarmente registrato presso l'Agenzia delle Entrate:","0","13-10-2021","31-12-9999"
"3","Di essere intestatario di contratto di locazione relativo a immobile di Edilizia Residenziale Pubblica.","0","13-10-2021","31-12-9999"
"4","Di essere comodatario con contratto di comodato d'uso gratuito regolarmente registrato presso l'Agenzia delle Entrate:","0","13-10-2021","31-12-9999"
"5","Di essere usufruttuario, in forza del seguente titolo costitutivo:","0","13-10-2021","31-12-9999"
"6","Di occupare legittimamente l'abitazione in base al titolo di seguito descritto: ","0","13-10-2021","31-12-9999"
